{
  "$schema": "https://json-schema.org/draft/2020-12/schema",
  "$id": "https://github.com/KokunoYumeto/mathematics-commons-pilot/blob/main/schemas/portal-catalog.schema.json",
  "title": "Mathematics Commons portal catalog",
  "type": "object",
  "additionalProperties": false,
  "required": ["schema", "updated", "repository", "sections"],
  "properties": {
    "schema": {"const": "math-commons-portal-catalog/v1"},
    "updated": {"type": "string", "format": "date"},
    "repository": {"type": "string", "format": "uri", "pattern": "^https://.+$"},
    "sections": {
      "type": "array",
      "minItems": 3,
      "maxItems": 3,
      "items": {"$ref": "#/$defs/section"}
    }
  },
  "$defs": {
    "nullablePath": {
      "oneOf": [
        {"type": "null"},
        {"type": "string", "minLength": 1}
      ]
    },
    "asset": {
      "type": "object",
      "additionalProperties": false,
      "required": ["name", "bytes", "sha256"],
      "properties": {
        "name": {"type": "string", "pattern": "^[A-Za-z0-9_.-]+[.]zip$"},
        "bytes": {"type": "integer", "minimum": 1},
        "sha256": {"type": "string", "pattern": "^[0-9A-F]{64}$"}
      }
    },
    "publishedRelease": {
      "type": "object",
      "additionalProperties": false,
      "required": ["tag", "url", "asset_count", "asset_bytes", "asset_catalog", "readback", "assets"],
      "properties": {
        "tag": {"type": "string", "minLength": 1, "pattern": "^[A-Za-z0-9][A-Za-z0-9._-]*$"},
        "url": {"type": "string", "format": "uri", "pattern": "^https://.+$"},
        "asset_count": {"type": "integer", "minimum": 1},
        "asset_bytes": {"type": "integer", "minimum": 1},
        "asset_catalog": {"$ref": "#/$defs/nullablePath"},
        "readback": {"type": "string", "minLength": 1},
        "assets": {"type": "array", "items": {"$ref": "#/$defs/asset"}}
      }
    },
    "pendingRelease": {
      "type": "object",
      "additionalProperties": false,
      "required": ["tag", "url", "asset_count", "asset_bytes", "asset_catalog", "readback", "assets"],
      "properties": {
        "tag": {"type": "null"},
        "url": {"type": "null"},
        "asset_count": {"const": 0},
        "asset_bytes": {"const": 0},
        "asset_catalog": {"type": "null"},
        "readback": {"type": "null"},
        "assets": {"type": "array", "maxItems": 0}
      }
    },
    "section": {
      "type": "object",
      "additionalProperties": false,
      "required": ["id", "title", "state", "docs", "catalog", "summary", "release", "limitations"],
      "properties": {
        "id": {"enum": ["transcription", "translation", "open-problems"]},
        "title": {"type": "string", "minLength": 1},
        "state": {"enum": ["runnable", "starter_available", "source_recovery_required"]},
        "docs": {"type": "string", "pattern": "^docs/[A-Za-z0-9_.-]+\\.md$"},
        "catalog": {"$ref": "#/$defs/nullablePath"},
        "summary": {"type": "string", "minLength": 1},
        "release": {
          "oneOf": [
            {"$ref": "#/$defs/publishedRelease"},
            {"$ref": "#/$defs/pendingRelease"}
          ]
        },
        "expected_asset": {"$ref": "#/$defs/asset"},
        "limitations": {
          "type": "array",
          "minItems": 1,
          "items": {"type": "string", "minLength": 1}
        }
      },
      "oneOf": [
        {
          "required": ["state"],
          "not": {"required": ["expected_asset"]},
          "properties": {
            "state": {"enum": ["runnable", "starter_available"]},
            "release": {"$ref": "#/$defs/publishedRelease"}
          }
        },
        {
          "required": ["state", "expected_asset"],
          "properties": {
            "state": {"const": "source_recovery_required"},
            "catalog": {"type": "null"},
            "release": {"$ref": "#/$defs/pendingRelease"}
          }
        }
      ]
    }
  }
}
